{
  "faction_names": {
    "cip": "顕現",
    "aggro": "猛攻",
    "spell": "詠唱",
    "inheritance": "継承",
    "mobility": "機動",
    "defense": "守護",
    "meta": "対抗"
  },
  "keyword_effects": {
    "連撃": "再行動コスト1回分で2回攻撃できる",
    "挑発": "召喚時、隣接する敵クリーチャー全ての向きをこのクリーチャーの方向に強制変更する",
    "先制": "防御時、攻撃を仕掛けた相手より先に反撃する",
    "不屈": "撃破されるとき、ゲーム中1回まで、破壊される代わりに体力1で残る",
    "暗殺": "対象の弱点範囲を突いて攻撃したとき、さらに追加で1ダメージを与える",
    "偏食": "木属性のクリーチャーまたは木属性フィールドにいるクリーチャーにしか攻撃できない",
    "重ね召喚": "場の味方クリーチャー1体を生贄に捧げ、そのマスに重ねて召喚できる。マナコストは差額分のみ。召喚されたターンは攻撃不可、ターン終了とならない",
    "魔道攻撃": "フィールド全体から対象を選べる。攻撃補正を行わず、反撃を受けない"
  },
  "characters": [
    {
      "id": "fire_001",
      "name": "双剣の戦士",
      "faction": "aggro",
      "cost": 4,
      "vp": 2,
      "hp": 3,
      "atk": 2,
      "reactivation_cost": 2,
      "attribute": "火",
      "attack_cells": [
        [
          1,
          0
        ]
      ],
      "counter_cells": [
        [
          1,
          0
        ]
      ],
      "weakness_cells": [
        [
          -1,
          0
        ]
      ],
      "attack_type": "物理",
      "keywords": [
        "連撃"
      ],
      "effect": "前方1マスから1体を選んで攻撃する。連撃により1回の再行動コストで2回攻撃できる。",
      "ult": null,
      "has_overlay": false,
      "attack_mode": "choice"
    },
    {
      "id": "fire_002",
      "name": "篝火の見張り",
      "faction": "meta",
      "cost": 2,
      "vp": 1,
      "hp": 2,
      "atk": 1,
      "reactivation_cost": 1,
      "attribute": "火",
      "attack_cells": [
        [
          1,
          0
        ],
        [
          0,
          1
        ],
        [
          0,
          -1
        ]
      ],
      "counter_cells": [
        [
          1,
          0
        ],
        [
          -1,
          0
        ],
        [
          0,
          1
        ],
        [
          0,
          -1
        ]
      ],
      "weakness_cells": [
        [
          -1,
          0
        ]
      ],
      "attack_type": "物理",
      "keywords": [],
      "effect": "相手がこのクリーチャーに隣接するマスにクリーチャーを召喚したとき、このクリーチャーの向きをそのマスに向けられる。",
      "ult": null,
      "has_overlay": false,
      "attack_mode": "simultaneous"
    },
    {
      "id": "fire_003",
      "name": "篝火の継承",
      "faction": "inheritance",
      "cost": 3,
      "vp": 2,
      "hp": 3,
      "atk": 2,
      "reactivation_cost": 2,
      "attribute": "火",
      "attack_cells": [
        [
          1,
          0
        ],
        [
          -1,
          0
        ]
      ],
      "counter_cells": [
        [
          1,
          0
        ],
        [
          -1,
          0
        ]
      ],
      "weakness_cells": [
        [
          0,
          1
        ],
        [
          0,
          -1
        ]
      ],
      "attack_type": "物理",
      "keywords": [],
      "effect": "召喚時、墓地からコスト2以下のクリーチャー1体を選び、その攻撃力をこのクリーチャーに加算する。そのクリーチャーは墓地から除外する（永続）。",
      "ult": null,
      "has_overlay": false,
      "attack_mode": "simultaneous"
    },
    {
      "id": "fire_005",
      "name": "燃え盛る門",
      "faction": "meta",
      "cost": 3,
      "vp": 2,
      "hp": 4,
      "atk": 1,
      "reactivation_cost": 3,
      "attribute": "火",
      "attack_cells": [
        [
          1,
          0
        ],
        [
          -1,
          0
        ],
        [
          0,
          1
        ],
        [
          0,
          -1
        ]
      ],
      "counter_cells": [
        [
          1,
          0
        ],
        [
          -1,
          0
        ],
        [
          0,
          1
        ],
        [
          0,
          -1
        ]
      ],
      "weakness_cells": [],
      "attack_type": "物理",
      "keywords": [],
      "effect": "相手がこのクリーチャーに隣接するマスにクリーチャーを召喚するたび、そのクリーチャーに1ダメージ。全方向1マスから1体を選んで攻撃する。",
      "ult": null,
      "has_overlay": false,
      "attack_mode": "choice"
    },
    {
      "id": "fire_007",
      "name": "連環の指揮者",
      "faction": "cip",
      "cost": 5,
      "vp": 3,
      "hp": 4,
      "atk": 2,
      "reactivation_cost": 4,
      "attribute": "火",
      "attack_cells": [
        [
          1,
          0
        ],
        [
          0,
          -1
        ],
        [
          0,
          1
        ]
      ],
      "counter_cells": [
        [
          1,
          0
        ],
        [
          0,
          1
        ],
        [
          0,
          -1
        ]
      ],
      "weakness_cells": [
        [
          -1,
          0
        ]
      ],
      "attack_type": "物理",
      "keywords": [],
      "effect": "召喚時、隣接する1マスを選ぶ。そのマスの属性を対立属性に変更する（火→水・水→火・土→木・木→土。無は変化なし）。前左右3マスから1体を選んで攻撃する。",
      "ult": null,
      "has_overlay": false,
      "attack_mode": "choice"
    },
    {
      "id": "fire_009",
      "name": "連鎖の発火点",
      "faction": "inheritance",
      "cost": 3,
      "vp": 1,
      "hp": 2,
      "atk": 2,
      "reactivation_cost": 2,
      "attribute": "火",
      "attack_cells": [
        [
          1,
          0
        ]
      ],
      "counter_cells": [
        [
          1,
          0
        ]
      ],
      "weakness_cells": [
        [
          -1,
          0
        ]
      ],
      "attack_type": "物理",
      "keywords": [],
      "effect": "このクリーチャーが撃破されたとき、自分の場の攻撃範囲が1体のみのクリーチャー1体に、次の自分のターン中「連撃」を付与する。連撃を持つクリーチャーは1回の再行動コストで2回攻撃できる。",
      "ult": null,
      "has_overlay": false,
      "attack_mode": "choice"
    },
    {
      "id": "fire_010",
      "name": "詠唱の余熱",
      "faction": "spell",
      "cost": 3,
      "vp": 1,
      "hp": 2,
      "atk": 1,
      "reactivation_cost": 2,
      "attribute": "火",
      "attack_cells": [
        [
          1,
          0
        ]
      ],
      "counter_cells": [
        [
          1,
          0
        ]
      ],
      "weakness_cells": [
        [
          -1,
          0
        ]
      ],
      "attack_type": "物理",
      "keywords": [],
      "effect": "自分がこのターン2枚目以降のスペルを唱えるたび、敵クリーチャー1体に1ダメージ。",
      "ult": null,
      "has_overlay": false,
      "attack_mode": "simultaneous"
    },
    {
      "id": "fire_011",
      "name": "詠唱の余韻",
      "faction": "spell",
      "cost": 3,
      "vp": 1,
      "hp": 2,
      "atk": 1,
      "reactivation_cost": 2,
      "attribute": "無",
      "attack_cells": [
        [
          1,
          0
        ]
      ],
      "counter_cells": [
        [
          1,
          0
        ]
      ],
      "weakness_cells": [
        [
          -1,
          0
        ]
      ],
      "attack_type": "物理",
      "keywords": [],
      "effect": "自分がスペルを唱えるたび、マナを1得る（1ターンに2回まで）。",
      "ult": null,
      "has_overlay": false,
      "attack_mode": "simultaneous"
    },
    {
      "id": "fire_014",
      "name": "血路の開拓者",
      "faction": "mobility",
      "cost": 4,
      "vp": 2,
      "hp": 3,
      "atk": 3,
      "reactivation_cost": 2,
      "attribute": "火",
      "attack_cells": [
        [
          1,
          0
        ]
      ],
      "counter_cells": [
        [
          1,
          0
        ]
      ],
      "weakness_cells": [
        [
          -1,
          0
        ]
      ],
      "attack_type": "物理",
      "keywords": [],
      "effect": "攻撃して敵を撃破したとき、撃破したマスへ移動する。",
      "ult": null,
      "has_overlay": false,
      "attack_mode": "simultaneous"
    },
    {
      "id": "fire_015",
      "name": "疾風の足軽",
      "faction": "mobility",
      "cost": 2,
      "vp": 1,
      "hp": 2,
      "atk": 1,
      "reactivation_cost": 1,
      "attribute": "火",
      "attack_cells": [
        [
          1,
          0
        ]
      ],
      "counter_cells": [
        [
          1,
          0
        ]
      ],
      "weakness_cells": [
        [
          -1,
          0
        ]
      ],
      "attack_type": "物理",
      "keywords": [],
      "effect": "攻撃する前に、隣接する空きマスへ移動できる（移動してから攻撃、その攻撃は移動先の向きで行う）。",
      "ult": null,
      "has_overlay": false,
      "attack_mode": "simultaneous"
    },
    {
      "id": "fire_016",
      "name": "創界の竜",
      "faction": "cip",
      "cost": 6,
      "vp": 4,
      "hp": 6,
      "atk": 3,
      "reactivation_cost": 4,
      "attribute": "火",
      "attack_cells": [
        [
          1,
          0
        ],
        [
          0,
          -1
        ],
        [
          0,
          1
        ]
      ],
      "counter_cells": [
        [
          1,
          0
        ],
        [
          0,
          1
        ],
        [
          0,
          -1
        ]
      ],
      "weakness_cells": [
        [
          -1,
          0
        ]
      ],
      "attack_type": "物理",
      "keywords": [
        "重ね召喚"
      ],
      "effect": "重ね召喚：自分の場のクリーチャー1体の上に重ねて召喚できる。召喚時、自分の場のクリーチャー1体の召喚時効果を発動する（この効果はこのカードの召喚時効果として扱う）。前左右3マスから1体を選んで攻撃する。",
      "ult": null,
      "has_overlay": true,
      "attack_mode": "choice"
    },
    {
      "id": "fire_ace_001",
      "name": "詠唱の極致",
      "faction": "spell",
      "cost": 7,
      "vp": 3,
      "hp": 5,
      "atk": 2,
      "reactivation_cost": 4,
      "attribute": "火",
      "attack_cells": [
        [
          1,
          0
        ]
      ],
      "counter_cells": [
        [
          1,
          0
        ],
        [
          0,
          1
        ],
        [
          0,
          -1
        ]
      ],
      "weakness_cells": [
        [
          -1,
          0
        ]
      ],
      "attack_type": "物理",
      "keywords": [],
      "effect": "場にいる間、自分がスペルを使うたび、そのスペルのダメージ+1。さらにマナを1得て、カードを1枚引く。",
      "ult": null,
      "has_overlay": false,
      "attack_mode": "simultaneous"
    },
    {
      "id": "fire_ace_002",
      "name": "戦煙の覇王",
      "faction": "aggro",
      "cost": 7,
      "vp": 4,
      "hp": 6,
      "atk": 3,
      "reactivation_cost": 4,
      "attribute": "火",
      "attack_cells": [
        [
          1,
          0
        ],
        [
          0,
          1
        ],
        [
          0,
          -1
        ]
      ],
      "counter_cells": [
        [
          1,
          0
        ],
        [
          0,
          1